News,Organization
Interviews for Team India head coach begin,Times of India
How hospitals use bizarre ways to steal funds,Times of India
What kind of petition is this?: SC on Article 370,Times of India
CDS post: Why India needs General No.1,Times of India
BSY promises lion’s share of jobs for Kannadigas,Times of India
4 held for trying to knock down cops in B'luru,Times of India
CM's I-Day message: Learn Kannada,Times of India
Aaradhya’s adorable Raksha Bandhan,Times of India
Saif Ail Khan’s best photos with his kids,Times of India
Saif Ail Khan’s best photos with his kids,Times of India
‘Prasthanam’: The first look poster,Times of India
Senior citizens spend more time on screens,Times of India
Singham Returns: Team share a throwback video,Times of India
Ishaan shares Shahid's pic from their road trip,Times of India
Puneeth Rajkumar donates Rs 5 lakh towards North Karnataka,Times of India
Nikhil Kumaraswamy visits flood affected areas in North,Times of India
When time came to a standstill in flooded Gokak,Times of India
Flood survivors wait for news about missing kin,Times of India
Lingayat line-up poses big test for Yediyurappa as,Times of India
Indians spend record forex on foreign travel,Times of India
Isro sowing seeds of future tech to help next gen,Times of India
"Cognizant set to cut more jobs, delays campus hires",Times of India
In numbers: Virat Kohli the run machine,Times of India
Pak hooligans target PIOs marking I-Day in UK,Times of India
"Papad, cosmetics push Khadi sales up 25%",Times of India
A unique way to celebrate India’s diversity,Times of India
Monkey’s 2-month terror reign ends with its rescue,Times of India
'Women should not get killed in the name of love',Times of India
"What Apple’s warning to FB, Google means for users",Times of India
"B'day pics: Saif with Taimur, Sara, Ibrahim",Times of India
President visits AIIMS to inquire Jaitley's health,Times of India
"Following J&K's reorganisation, people from other states are now eligible to buy property there.",Economic times
Can India blame Trump for the slump? A view,Economic times
'Pics of deities found at disputed Ayodhya site',Economic times
Cognizant readies more pink slips to cut costs,Economic times
We would like to give little time: SC on 370,Economic times
A lot for India now depends on your shopping,Economic times
AM Naik on what Modi should focus on first,Economic times
Desis’ Q1 foreign trip bill at new high,Economic times
Agencies may go to Interpol to track Winsome boss,Economic times
UNSC to meet on Kashmir at China's behest ,Economic times
Your freedom won’t be curtailed: Reddy to Kashmiris,Economic times
Rs 45k cr Ladakh solar plant faces site pain,Economic times
What RBI probe into debt-laden IL&FS reveals,Economic times
India's planned IAF booster hits price wall,Economic times
India to have Chief of Defence staff soon ,Economic times
Balakot operation unmatchable: Woman IAF officer,Economic times
How the business of movies is changing,Economic times
Government to launch Jal Jeevan Mission: Modi ,Economic times
Saudi to regain India's top oil supplier spot,Economic times
A good news awaits electronic goods makers,Economic times
Foreign brokerages' take on top D-Street stocks,Economic times
Keep powder dry & look for opportunities: Kotak AMC,Economic times
What’s going on in the equity markets?,Economic times
Yes Bank to raise 2nd tranche of capital soon: CEO,Economic times
Mkt waiting for booster dose from govt in 7-10 days,Economic times
ITR filing: Don't forget to claim TDS credit,Economic times
Is it time to stop investing in equity MF schemes?,Economic times
How 'smart' education is making students tech addict,Economic times
Festival season to see a surge in ad spends,Economic times
"Companies offer free flights, deploy feedback apps",Economic times
Sky is not the limit for ISRO,Economic times
Is India ready for quant-based fund management?,Economic times
India’s payment apps battle to heat up further,Economic times
Airtel readies value-rich plan to chase high-paying users,Economic times
"Textile companies seek tax incentives, DBT for farmers",Economic times
ET readership crosses 1 million per day mark,Economic times
N Korea: No wish to talk with S Korea,CNN
A tiny British territory defied the US,CNN
OPINION A global recession is looming,CNN
Thousands protest for Kashmir,CNN
Man executed by electric chair in US,CNN
Video shows truck driving at protesters,CNN
Triathletes disqualified for holding hands,CNN
HK protesters call for 'Mulan' boycott after star went public,CNN
Traveling to Hong Kong? Here's what you need to know,CNN
Hong Kong spends billions to avert recession,CNN
Hong Kong housing is in short supply,CNN
Simon Cowell looks different on vegan diet,CNN
Disney had 5 $1B movies in a year,CNN
Nascar driver survives plane crash,CNN
Norway detects radioactive iodine,CNN
Boxing's 'Clash of the Dunes' in Saudi Arabia sparks furore,CNN
'Hollywood Ripper' found guilty of murde,CNN
Asian markets mixed as trade and recession worries linger,CNN
Ikea and the Queen of Sweden are teaming up,CNN
Why London is tracking passengers on the Tube,CNN
Bad economic news raises political risks for Trump,CNN
America's longest running war may end,CNN
CNN Exclusive: New documents reveal behind-the-scenes clash over spending inside Trump inaugural committee,CNN
Why Pelosi has yet to embrace impeachment,CNN
